{
  "$schema": "https://json-schema.org/draft/2020-12/schema",
  "$id": "https://github.com/durable-workflow/.github/blob/main/stable-authorization/contract-schema.json",
  "title": "Durable Workflow stable authorization contract",
  "type": "object",
  "additionalProperties": false,
  "required": [
    "$schema",
    "schema",
    "stable_version",
    "artifact_components",
    "release_critical_experiments",
    "required_sdk_cells",
    "evidence_policy",
    "human_decision"
  ],
  "properties": {
    "$schema": {
      "const": "./contract-schema.json"
    },
    "schema": {
      "const": "durable-workflow.stable-authorization.contract/v1"
    },
    "stable_version": {
      "const": "2.0.0"
    },
    "artifact_components": {
      "const": [
        "workflow",
        "waterline",
        "server",
        "cli",
        "sdk-php",
        "sdk-python",
        "sdk-rust"
      ]
    },
    "release_critical_experiments": {
      "const": [
        "activities",
        "cloud",
        "heartbeats",
        "namespaces",
        "polyglot",
        "replay",
        "signals-queries",
        "timers",
        "worker-versioning",
        "workflow-lifecycle",
        "workflow-updates",
        "python"
      ]
    },
    "required_sdk_cells": {
      "const": {
        "polyglot": [
          "php",
          "python",
          "rust"
        ]
      }
    },
    "evidence_policy": {
      "const": {
        "artifact_tuple_binding": "exact",
        "missing": "deny",
        "stale": "deny",
        "non_passing": "deny",
        "runner_blocked": "deny",
        "aggregate_historical_pass_rate": "never_authoritative"
      }
    },
    "human_decision": {
      "const": {
        "required": true,
        "occurs_after_evidence_gate": true
      }
    }
  }
}
