{
  "$schema": "./contract-schema.json",
  "schema": "durable-workflow.stable-authorization.contract/v1",
  "stable_version": "2.0.0",
  "artifact_components": [
    "workflow",
    "waterline",
    "server",
    "cli",
    "sdk-php",
    "sdk-python",
    "sdk-rust"
  ],
  "release_critical_experiments": [
    "activities",
    "cloud",
    "heartbeats",
    "namespaces",
    "polyglot",
    "replay",
    "signals-queries",
    "timers",
    "worker-versioning",
    "workflow-lifecycle",
    "workflow-updates",
    "python"
  ],
  "required_sdk_cells": {
    "polyglot": [
      "php",
      "python",
      "rust"
    ]
  },
  "evidence_policy": {
    "artifact_tuple_binding": "exact",
    "missing": "deny",
    "stale": "deny",
    "non_passing": "deny",
    "runner_blocked": "deny",
    "aggregate_historical_pass_rate": "never_authoritative"
  },
  "human_decision": {
    "required": true,
    "occurs_after_evidence_gate": true
  }
}
